Unnamed: 0	article_id	article_auteur	article_détail	article_titre	revue_annee	revue_numero	article_page	Unnamed: 8
56.0	AHMC-29-229	Bouffard		I. Mémoires originaux. La pneumococcie chez les noirs(1).	1931	29	229	
57.0	AHMC-29-235	Albert Sallet		Les nids d'hirondelles.	1931	29	235	
58.0	AHMC-29-246	Fonquernie		I. Mémoires originaux. Quelques considérations sur la peste à Tananarive. (Épidémiologie, clinique, traitement).	1931	29	246	
69.0	AHMC-29-286	Fulconis		La peste au Sénégal en 1929.	1931	29	286	
70.0	AHMC-29-311	Marque	Extrait d’un rapport	La peste dans la circonscription de Dakar et dépendances, en 1929.	1931	29	311	
71.0	AHMC-29-318	Couvy	Extrait d’un rapport	II. Études et observations cliniques. La peste à l'hôpital central indigène de Dakar, en 1929.	1931	29	318	
72.0	AHMC-29-329	Lefèvre		II. Études et observations cliniques. Urticaire géante au cours d'une dracunculose.	1931	29	329	
73.0	AHMC-29-332	Guillon		À propos du traitement des distomatoses hépatiques.	1931	29	332	
74.0	AHMC-29-337	Y. Chaigneau ;M. Chauzy	Historique de la question	II. Études et observations cliniques. Quelques notes au sujet d'une épidémie d'ictère Bénin survenue en 1929 au 1er bataillon du 10e régiment de Sénégalais à Tunis.	1931	29	337	
81.0	AHMC-29-346	Mury		II. Études et observations cliniques. La méthode de Whipple dans les affections coloniales.	1931	29	346	
82.0	AHMC-29-353	Boyé	I. Ce que fut la mortalité dans les essais antérieurs. II. La main-d'oeuvre chinoise au Conco français en 1929-1930	III. Note documentaire. L'emploi de la main-d'oeuvre chinoise au Congo français(1)	1931	29	353	NB : Note présentée au Comitépermanentdel’Office international d’Hygiène publique. Octobre 1930
98.0	AHMC-29-427	Ledentu		I. Mémoires originaux. Essai de nosographie du Gabon.	1931	29	427	
104.0	AHMC-29-479	Bonnecarrère ; Bertrand 	Influence du milieu économique et social sur la mortinatalité et la mortalité infantile	I. Mémoires originaux. La mortinatalité et la mortalité infantile au Togo au point de vue économique et social.	1931	29	479	NB : l'OEuvre du Berceau était sous le patronage de l'épouse du Gouverneur Bonnecarrère et rattachée au siège central à Paris.
107.0	AHMC-29-503	Cheyssial		Étude de la ration alimentaire des indigènes du territoire du Togo.	1931	29	503	
108.0	AHMC-29-516	Martial	A. Y a-t-il un régime alimentaire optimum pour les indigènes différent de celui des Européens ? B. Que mangent les indigènes dans leur pays d'origine ? C. Comment utiliser et comment apprêter les denrées indigènes D. A quel taux donner le riz et les denrées de substitution ? E. Comment préparer la ration de nos tirailleurs ?	I. Mémoires originaux. Contribution à l'étude de l'alimentation du tirailleur Sénégalais en Afrique occidentale Française.	1931	29	516	
113.0	AHMC-29-532	Sorel ; Robineau 		I. Mémoires originaux. La trypanosomiase en Afrique occidentale Française.	1931	29	532	
117.0	AHMC-29-561	Letonturier		Le service médical des travailleurs indigènes en Cochinchine.	1931	29	561	
118.0	AHMC-29-571	Augagneur ; Nguyen-Van-Hoai 		II. Notes cliniques. Un cas d'othématome chez un paralytique général indigène en Cochinchine.	1931	29	571	
119.0	AHMC-29-575	Augagneur		II. Notes cliniques. Dermite érythémato-bulleuse d'origine quinique.	1931	29	575	
121.0	AHMC-29-588	la Fondation Léonard Wood pour la suppression de la lèpre		IV. Notes documentaires. Conférence sur la lèpre organisée à Manille (Philippines),	1931	29	588	
131.0	AHMC-29-635	Toullec		I. Mémoires originaux. La tuberculose des sénégalais. Considérations cliniques, épidémiologiques et prophylactiques.	1931	29	635	
135.0	AHMC-29-652	Chaigneau		Application dans un bataillon de sénégalais du nouvel indice de robusticité pour noirs, de G. Lefrou.	1931	29	652	
136.0	AHMC-29-661	Ledentu	Introduction	I. Mémoires originaux. Chronique documentaire. Les maladies transmissibles observées dans les colonies françaises et territoires sous mandat pendant l'année 1929.	1931	29	661	
168.0	AHMC-29-852	Peirier		III. Notes cliniques et thérapeutiques. Injections intraveineuses de chaulmoograte de soude.	1931	29	852	
169.0	AHMC-29-860	Laquièze		Spirilloses intestinales en Nouvelle-Calédonie.	1931	29	860	
170.0	AHMC-29-861	Tournier		Les éléments de la thérapeutique du béribéri.	1931	29	861	
171.0	AHMC-29-871	Tournier		Le kermès, ses applications en pathologie exotique.	1931	29	871	
172.0	AHMC-29-875	Gauducheau		IV. Notes documentaires. I. Mesures d'hygiène à prendre pour la conservation des aliments, particulièrement dans les pays chauds. II. Nouveau procédé de préparation des viandes.	1931	29	875	
0.0	AHMC-30-5	Huard	A. Les myosites et pseudo-myosites sans état septicémique. B. Les myosites et les pseudo-myosites liées à des états septicémiques. C. Comment examiner une myosite ? D. Traitement des myosites et des pseudo-myosites Bibliographie	I. Mémoires originaux. Les myosites et les pseudo-myosites en milieu colonial.	1932	30	5	
5.0	AHMC-30-34	F. Guichard ;C.Aubert	Application au procédé indigène actuel. Analyse du procédé. Caractéristiques comparées de ces huiles	I. Mémoires originaux. Contribution à l'étude de la décoloration des huiles de palme. Application à l'amélioration du procédé indigène de préparation de ces huiles.	1932	30	34	
9.0	AHMC-30-59	Raynal		Quelques notes médicales sur le Guatémala.	1932	30	59	
10.0	AHMC-30-84	Philaire ;Grizaud		II. Notes cliniques. Un cas de main bote radio-palmaire congénitale bi-latérale.	1932	30	84	
11.0	AHMC-30-90	Hilleret ;Charpentier		II. Notes cliniques. Considérations médico-militaires sur quelques cas de béribéri constatés au 1er bataillon sénégalais de Tananarive et au 2e bataillon malgache de Majunga du 1er régiment mixte de Madagascar.	1932	30	90	
12.0	AHMC-30-96	Chaigneau ;Chauzy		II. Notes cliniques. Quelques considérations sur la pneumococcie au bataillon sénégalais de Tunis.	1932	30	96	
13.0	AHMC-30-101	Peyre	Extrait d’un rapport	III. Chronique et notes documentaires. La peste au Sénégal en 1930	1932	30	101	
	AHMC-30-108	Cazanove	Extrait d’un rapport	 III. Chronique et notes documentaires. Le problème du rat dans le territoire de Dakar et dépendances.	1932	30	108	
28.0	AHMC-30-161	M. le Professeur Hermann Wintz, et M	Walter Rump	Mesures de protection contre les dangers résultant de l'emploi des rayons du radium, roentgen et ultra-violet.	1932	30	161	
35.0	AHMC-30-261	E. Bédier ;F. Guichard		I. Travaux originaux. Contribution à l'étude et à la verdunisation (procédé bunau-varilla) des eaux de distribution de la ville de Douala.	1932	30	261	
36.0	AHMC-30-280	M. F. Guichard ; C. Aubert 		I. Travaux originaux. Contribution à l'étude de la décoloration sur place des huiles de palme. Conséquences et applications.	1932	30	280	
37.0	AHMC-30-292	A. de Raymond		II. Note clinique. Un nouveau traitement des diarrhées cholériformes et éventuellement du choléra.	1932	30	292	
38.0	AHMC-30-296	Lefèvre	Introduction	III. Chronique documentaire. Les maladies transmissibles observées dans les colonies françaises et territoires sous mandat, pendant l'année 1930.	1932	30	296	
54.0	AHMC-30-406	G. Lefrou ; Allard 		III. Chronique documentaire. Une décade démographique (1921-1930) à Saint-Louis-du-Sénégal. Natalité, mortalité générale, mortinatalité, mortalité infantile.	1932	30	406	
65.0	AHMC-30-461	Gaide ; Bodet 		I. Mémoires originaux. Note sur le fonctionnement des maternités et sur la prévention de la tuberculose, par le B. C. G. en Indochine.	1932	30	461	
66.0	AHMC-30-478	Dr Marqueissac		Fonctionnement des équipes de prospection et de traitement du secteur de prophylaxie de la trypanosomiase au Togo.	1932	30	478	
67.0	AHMC-30-487	G. Lefrou 		L'importance de la taille assis comme base d'un indice de robusticité.	1932	30	487	
68.0	AHMC-30-490	H. Sergent 		I. Mémoires originaux. Contribution à l'étude d'un nouvel indice de robusticité chez les noirs (indice de Lefrou).	1932	30	490	
69.0	AHMC-30-493	J.-P. Pluchon ; H. Ginet 		Étude sur le lait consommé à Lome (Togo).	1932	30	493	
70.0	AHMC-30-516	Laurence		II. Notes cliniques. L'invasion primitive tuberculeuse chez le tirailleur sénégalais et ses rapports avec les séquelles d'affections pleuro-pulmonaires.	1932	30	516	
76.0	AHMC-30-532	Ott		II. Notes cliniques. Les deux types d'évolution de la fièvre bilieuse hémoglobinurique au Laos.	1932	30	532	
77.0	AHMC-30-546	Lefèvre	Pneumococcies	III. Chroniques documentaires. Les maladies transmissibles dans les colonies françaises et territoires sous mandat pendant l'année 1930 (suite).	1932	30	546	
88.0	AHMC-30-569	Bouffard	Extrait d'un rapport sur la main-d'oeuvre indigène et asiatique 	La pneumonie sur les chantiers du chemin de fer «Congo-Océan»	1932	30	569	
103.0	AHMC-30-635	Mercier	Indochinois-Européens- Interprétation des résultats	I. Mémoires originaux. Notes sur les résultats obtenus dans le traitement du paludisme par l'emploi de la quinoplasmine.	1932	30	635	
108.0	AHMC-30-653	Fréville	I. Généralités. II. Origine, modalités de l'invasion pesteuse. — Historique-III. La prophylaxie de la peste en Cochinchine. IV. Recherches zoologiques	Contribution à l'épidémiologie de la peste en Cochinchine.	1932	30	653	
114.0	AHMC-30-679	J.-C. Perier ; Nguyen-Kim-Kinh		Dosage rapide et précis des acides aminés et des polypeptides dans le Nuoc-Mam	1932	30	679	
115.0	AHMC-30-694	Fabry		Réflexions cliniques sur 163 cas de béribéri.	1932	30	694	
116.0	AHMC-30-708	Bonhaud	II. Mentalité de l'indigène normal. Formation des complexes. III. Dépistage des affections mentales. IV. Symptômes précoces permettant le diagnostic d'un état mental anormal. V. Rôle des officiers de troupe	I. Mémoires originaux. Essai sur les affections mentales chez les indigènes des troupes coloniales en France.	1932	30	708	
121.0	AHMC-30-723	E. Bédier ; V. Brégi		I. Mémoires originaux. Cuti-réaction à la tuberculine et séro-floculation à la résorcine chez les indigènes de Douala. 	1932	30	723	
122.0	AHMC-30-727	Grimes		II. Chronique documentaire. Essai de prophylaxie de la rougeole dans un camp de travailleurs indigènes. Hémo-atténuation sur l’effectif d’un camp S.M.O.T.I.G. à Tamatave	1932	30	727	
123.0	AHMC-30-730	André Augagneur ;N'Guyen-Van-Hoai ; Co-Quat-Gia		II. Chronique documentaire.Intoxication mortelle par ingestion d'oeufs de crapaud. 	1932	30	730	
124.0	AHMC-30-733	André Augagneur ;N'Guyen-Van-Hoai ; Co-Quat-Gia		II. Chronique documentaire. Réaction par la siliquid dans le liquide céphalo-rachidien	1932	30	733	
125.0	AHMC-30-736	Colin		II. Chronique documentaire. Considérations générales sur les causes qui ont pu influencer l'état sanitaire en Mauritanie.	1932	30	736	
0.0	AHMC-31-5	R. Pons ; Advier	Chapitre premier. Chapitre II. Protocole des essais-Études complémentaires- Action anergisante de la vaccination pour un organisme infecté-	I. Mémoires originaux. Méthode expérimentale d'étude du pouvoir immunisant d'un vaccin anti-pesteux. Son application à un vaccin huileux et à un vaccin aqueux. Recherche de la phase négative et de l'action anergisante de la vaccination anti-pesteuse.	1933	31	5	
5.0	AHMC-31-25	Vaucel	I. Les trypanosomes polymorphes. — Leurs relations et l'adaptation à l'homme. II. Transmission. — Biologie des glossines. III. Biologie des trypanosomes. IV. L'action du sérum sanguin. V. Évolution des trypanosomiases. VI. Répartition de la trypanosomiase humaine. VII. Diagnostic. VIII. Mécanisme de l'action chimiothérapique.IX. Thérapeutique  X. — Traitement abortif et prophylaxie XI. — Accidents oculaires  XIII. — Arsenico-résistance	I. Mémoires originaux. Les acquisitions nouvelles dans l'étude des trypanosomiases.	1933	31	25	
17.0	AHMC-31-63	J. Tisseuil		I. Mémoires originaux. Le problème de la lèpre en 1932.	1933	31	63	
18.0	AHMC-31-68	Berny		I. Mémoires originaux. Création et organisation d'un village de lépreux au Moyen-Congo.	1933	31	68	
19.0	AHMC-31-78	Ferré		I. Mémoires originaux. Préparation anti-lépreuse à partir d'huiles de caloncobas du Cameroun.	1933	31	78	
20.0	AHMC-31-83	Millous		I. Mémoires originaux. La valeur numérique de l'homme et l'utilisation de l'indice pignet chez les noirs et en particulier chez les togolais.	1933	31	83	
21.0	AHMC-31-93	Laquieze ;Berny		II. Chronique documentaire. La parfaite tolérance du noir pour la ponction lombaire et sa réalisation très pratique dans un secteur de prophylaxie en A. E. F.	1933	31	93	
22.0	AHMC-31-96	Laquieze ;Berny		II. Chronique documentaire. Note sur onze observations de trypanosomés atteints de frigidité génitale.	1933	31	96	
23.0	AHMC-31-100	Laquieze ;Berny		II. Chronique documentaire. Note sur l'arrêt des menstruations chez les trypanosomées.	1933	31	100	
24.0	AHMC-31-102	Lavier		II. Chronique documentaire. La pathologie des îles Saint-Pierre et Miquelon.	1933	31	102	
27.0	AHMC-31-123	Marque	Introduction- I. — Maladies pestilentielles. II. — Maladies endémo-épidémiques- III. — Maladies transmissibles communes à la métropole et aux colonies. IV. — Maladies sociales 	I. Chronique documentaire. Les maladies transmissibles observées dans les colonies françaises et territoires sous mandat pendant l'année 1931.	1933	31	123	
32.0	AHMC-31-325	J. Laigret 		I. Mémoires originaux. La vaccination contre la fièvre jaune.	1933	31	325	
33.0	AHMC-31-336	Bauvallet	Observation I. Observation II. Observation III. Observation IV Observation V. Observation VI Observation V. Observation VI Observation VII Observation VIII Observation IX Observation X Observation XI Observation XII Observation XIII Observation XIV Observation XV Observation  XVI Observation XVII Observation XVIII Observation XIX Observation XX Observation XXI Observation XXII Observation XXIII Observation XXIV Observation XXV Observation XVI 	I. Mémoires originaux. La tuberculose chez les noirs de l'Afrique occidentale française, ses formes chirurgicales constatées en Europe.	1933	31	336	
50.0	AHMC-31-364	Fabry		I. Mémoires originaux. Asthénie tropicale à manifestation hypotensive élective.	1933	31	364	
51.0	AHMC-31-372	Talec ;N. Nadessin 		II. Chroniques documentaires. Le fonctionnement de la maternité de l'hôpital colonial de Pondichéry pendant l'année 1932.	1933	31	372	
56.0	AHMC-31-388	Lefèvre	Extrait d'un rapport de 1933	II. Chroniques documentaires. La climatologie du Togo.	1933	31	388	
57.0	AHMC-31-396	Lefèvre	Extrait d'un rapport de 1933	II. Chroniques documentaires. Les services d'hygiène au Togo.	1933	31	396	
58.0	AHMC-31-407	Huchon		II. Chroniques documentaires. Note sur un traitement accessoire des rectites chroniques.	1933	31	407	
68.0	AHMC-31-445	M. Peyre	I. Introduction. Première partie. Organisation actuelle. Deuxième partie. Réalisations en cours et projets-	I. Mémoires originaux. Les problèmes de l'assistance mentale aux colonies.	1933	31	445	
71.0	AHMC-31-497	H. Aubin		De quelques aspects des psychoses dans l'Inde.	1933	31	497	
72.0	AHMC-31-512	Pales	Les myosites et les pseudo-myosites sans état septicémique-Les myosites et les pseudo-myosites liées à des états septicémiques- Examens-Traitement des myosites et des pseudo-myosites	I. Mémoires originaux. Les myosites et les pseudomyosites dans le milieu indigène en Afrique équatoriale française.	1933	31	512	
76.0	AHMC-31-531	Durand		I. Mémoires originaux. L'aviation sanitaire en Afrique équatoriale française.	1933	31	531	
77.0	AHMC-31-536	Phiquepal d'Arusmont		II. Notes documentaires. Sur un cas de réveil tardif de paludisme constaté à Saint-Pierre et Miquelon.	1933	31	536	
78.0	AHMC-31-538	Pierre Chesneau		II. Notes documentaires. Le rayonnement des infirmeries d'une province du Sud-Annam.	1933	31	538	
79.0	AHMC-31-543	Gaulène		II. Notes documentaires. Coutumes pahouines et médecine sociale au Gabon.	1933	31	543	
80.0	AHMC-31-551	Grizaud		II. Notes documentaires. Quelques réflexions sur une léproserie de l'atlantique (la désirade guadeloupe.).	1933	31	551	
0.0	AHMC-32-5	A. Gauducheau		I. Mémoires originaux. Note sur la prophylaxie antivénérienne individuelle présentée à la commission consultative au ministère des colonies le 30 janvier 1934.	1934	32	5	
1.0	AHMC-32-17	M. Bouillat	Premier chapitre	II. Notes documentaires. L'huile de chaulmoogra, son rôle dans le traitement de la lèpre, sa fabrication à la pharmacie du gouvernement de Pondichéry.	1934	32	17	
8.0	AHMC-32-46	Jonchère	Le Paludisme en Yougoslavie-Le Paludisme en Italie. Les races d'A. maculipennis et leurs rapports avec le paludisme-Différenciation basée sur les caractères de l'oeuf -Prophylaxie du Paludisme en Italie. Thérapeutique du Paludisme-Conclusions. Bibliographie	Quelques conceptions actuelles sur l'épidémiologie et le traitement du paludisme.	1934	32	46	
15.0	AHMC-32-70	Millous		I. Mémoires originaux. Note sur le rhumatisme aigu et les particularités des arthrites aiguës sous les tropiques.	1934	32	70	
16.0	AHMC-32-78			II. Notes documentaires. L'état actuel de la vaccination contre la fièvre jaune	1934	32	78	
17.0	AHMC-32-84			II. Notes documentaires. La vaccination par le BCG aux colonies	1934	32	84	
18.0	AHMC-32-87	Ferré		II. Notes documentaires. Le Tsembal plante galactogène des foulbés.	1934	32	87	
19.0	AHMC-32-91		Congrès sur la protection de l’Enfance	II. Notes documentaires. Géographie médicale. Mutilations génitales pratiquées dans certaines tribus des Indes néerlandaises	1934	32	91	
20.0	AHMC-32-96			II. Notes documentaires. Plan de recherches sur le paludisme par la Commission du Paludisme de la Société des Nations 	1934	32	96	
33.0	AHMC-32-153	Grosfillez	I. — Maladies pestilentielles. II. — Maladies endémo-épidémiques III. — Maladies cosmopolites IV. — Maladies sociales. Maladies vénériennes	I. Chronique documentaire. Les principales maladies observées dans les colonies françaises et territoires sous mandat en 1932.	1934	32	153	
39.0	AHMC-32-268	P. Rodes		I. Chronique documentaire. Contribution à l'étude des mammifères vecteurs de la peste. Détermination de quelques espèces.	1934	32	268	
40.0	AHMC-32-272			Note succincte sur les tumeurs malignes observées dans les colonies françaises en 1932	1934	32	272	
43.0	AHMC-32-285	G. Girard ; J. Robic 		I. Travaux originaux. Vaccination contre la peste au moyen d'une souche de bacilles de Yersin vivants, de virulence atténuée.	1934	32	285	
44.0	AHMC-32-293	J.-P. Léger		I. Travaux originaux. Une saison de peste en brousse malgache.	1934	32	293	
51.0	AHMC-32-309	H.-M. Monier ; R. Guy, Médecin ; Ros 		I. Travaux originaux. Renseignements sur le paludisme recueillis dans les régions de Luang-Prabang et Paklay, au Laos.	1934	32	309	
54.0	AHMC-32-328	V. Labernadie		I. Travaux originaux. Essais de traitement de lépreux par des injections intraveineuses d'huile de chaulmoogra.	1934	32	328	
55.0	AHMC-32-338	Bertrand		I. Travaux originaux. Les maladies des yeux en pays Cabrais (Nord-Togo).	1934	32	338	
56.0	AHMC-32-350	Cartron		I. Travaux originaux. Étude démographique comparée des pays Bamilléké et Bamoum (Caméroun).	1934	32	350	
57.0	AHMC-32-364	Gaulène		II. Notes documentaires. L'étiologie des maladies et l'influence des sorciers chez les pahouins.	1934	32	364	
58.0	AHMC-32-370	Guichard		Contribution à l'étude générale des terres de surface du Caméroun.	1934	32	370	
59.0	AHMC-32-379	Dantec		II. Notes documentaires. Nouvelle réaction de l'antipyrine, son application à sa recherche et son dosage dans le pyramidon.	1934	32	379	
60.0	AHMC-32-382	Dantec		II. Notes documentaires. Note au sujet de la solution de xanthydrol dans l'alcool méthylique pour le dosage de l'urée.	1934	32	382	
61.0	AHMC-32-384	Dantec ;Giboin		Étude de stabilité du carburant national à la colonie.	1934	32	384	
78.0	AHMC-32-441	Advier	Le virus amaril neurotrope de la souris blanche- Recherches faites à l'institut Pasteur de Dakar avec le virus amaril de la souris blanche-Étude critique du virus amaril de la souris blanche.- Transmission au macacus rhesus de l'infection amarile humaine	I. Travaux originaux. Étude expérimentale de la fièvre jaune(1).	1934	32	441	
82.0	AHMC-32-472	G. Saleun ; H. Monier	Méthode de coloration de Césaris-Demel- Méthode d'enrichissement. Méthodes recommandées pour la coloration des frottis de sang-Réactions précipitantes. Méthode de conservation des moustiques infectés-Méthode rapide de Barber pour l'examen des glandes salivaires. Fixation et montage d'estomac ou de glandes salivaires des moustiques. Contrôle de la distribution du vert de Paris. Contrôle de la distribution du vert de Paris. Réaction granulo-filamenteuse.Évolution du sporozoïte. Sur la présence d'anticorps dans le paludisme. Expériences récentes de Neuman. Stérilisation des gamètes par la plasmoquine 	I. Travaux originaux. Renseignements et techniques particulières recueillis à l'école italienne de malariologie.	1934	32	472	
93.0	AHMC-32-493	V. Dufour;N. Gourry 		I. Travaux originaux. Les troubles de suralimentation du nourrisson indigène en A.O.F. Étude clinique et chimique des laits maternels indigènes.	1934	32	493	
97.0	AHMC-32-546	Rédaction des Annales		II. Chronique documentaire. Notions pratiques sur les succédanés de la quinine dans le traitement du paludisme	1934	32	546	
98.0	AHMC-32-552	M.-E Farinaud 		II. Chronique documentaire. Les possibilités de l'atébrine en prophylaxie collective(1).	1934	32	552	
99.0	AHMC-32-559	Grall		II. Chronique documentaire. La protection de l'enfance à Bambari (A. É. F.).	1934	32	559	
100.0	AHMC-32-564	Laouilheau		II. Chronique documentaire. Vaccination antituberculeuse par le B.C.G. dans la circonscription du chemin de fer en Afrique équatoriale française.	1934	32	564	
101.0	AHMC-32-567	Jolly ;Ouary ;Machelidon		II. Chronique documentaire. Néphrite hydropigène. Décapsulation du rein gauche. Guérison.	1934	32	567	
102.0	AHMC-32-572	Gaignaire		II. Chronique documentaire. Confusion mentale. Mélancolie anxieuse et mélancolie délirante curable d'origine paludéenne.	1934	32	572	
103.0	AHMC-32-574	Lafleur		II. Chronique documentaire. Contribution à l'étude des croyances des indigènes de la Haute Sangha au sujet du pian.	1934	32	574	
104.0	AHMC-32-579	Lafleur		II. Chronique documentaire. Étude sommaire d'un fruit de brousse, le «Bellé».	1934	32	579	
105.0	AHMC-32-581	Ochotine		L'art médical indigène au Congo français.	1934	32	581	
0.0	AHMC-33-5	Cartron	Lèpre-Traitements et résultats-Résultats. Conclusions	I. Mémoires originaux. Étude sur la lèpre, dans la circonscription de Dschang (Cameroun). Bamoums et Bamillékés.	1935	33	5	
5.0	AHMC-33-24	Aubin		I. Mémoires originaux. Conceptions nosologiques actuelles en psychiatrie.	1935	33	24	
6.0	AHMC-33-34	E. Monnier	Le fromage frais de soja. La sauce de soja. La crème de soja.Bibliographie	I. Mémoires originaux. Les préparations à base de graines de soja, dans l'alimentation des annamites.	1935	33	34	
11.0	AHMC-33-57	Bellocq		I. Mémoires originaux. Cuti-réactions à la tuberculine, et prémunition par le B. C. G. des tirailleurs de la garnison de Brazzaville.	1935	33	57	
12.0	AHMC-33-64	Lefèvre	Compte rendu des rapports et communications	II. Chronique documentaire. Congrès de la colibacillose.	1935	33	64	
14.0	AHMC-33-90	Blanchard	Historique.Recrutement des élèves. Fonctionnement de l'École. Les résultats 	II. Chronique documentaire. L'école de médecine de l'Afrique Occidentale française de sa fondation à l'année 1934.	1935	33	90	
18.0	AHMC-33-112	Labernadie		II. Chronique documentaire. Rapport sur le fonctionnement de l'école de médecine de Pondichéry pendant l'année scolaire 1932-1933.	1935	33	112	
19.0	AHMC-33-121	Ledentu		II. Chronique documentaire. Rapport sur le fonctionnement du centre d'instruction d'Ayos (Cameroun).	1935	33	121	
20.0	AHMC-33-126	Martial		II. Chronique documentaire. Épidémie de variole dans la province de Lang-Son (Tonkin) en 1934.	1935	33	126	
21.0	AHMC-33-136	E. Farinaud		II. Chronique documentaire. L'emploi de l'atébrine dans la prophylaxie collective du paludisme dans les exploitations agricoles.	1935	33	136	
22.0	AHMC-33-140	G. Grall		II. Chronique documentaire. Note sur la microfilariose loa. Ses symptômes et son traitement.	1935	33	140	
22.0	AHMC-33-140	G. Grall		II. Chronique documentaire.  L'action thérapeutique du Service de la trypanosomiase en A.O.F. jugée par les Bandas de l'Oubangui-Chari : le «ballet de la maladie du sommeil»	1935	33	140	
24.0	AHMC-33-146	Pujo		Notes sur la soif en région désertique.	1935	33	146	
25.0	AHMC-33-154	Gouin		Placenta proevia central et césarienne basse.	1935	33	154	
26.0	AHMC-33-160	Retière ; Borrey 		Les injections intra-veineuses d'alcool, en thérapeutique journalière.	1935	33	160	
27.0	AHMC-33-168	Borrey		Anesthésies au numal et à l'évipan sodique et rachianesthésie à la cocaïne.	1935	33	168	
28.0	AHMC-33-176	Borrey		Essais d'un traitement antisyphilitique standard arseno-mercuriel avec pyrétothérapie associée.	1935	33	176	
52.0	AHMC-33-241	C. Baril		I. Mémoires originaux. Une page d'histoire médicale. Rapport médical sur l'expédition militaire du Logo et l'épidémie de fièvre jaune qui la termina.	1935	33	241	Copié par Louis Gentil à partir d’un manuscrit de 1878 retrouve au Ministère des Colonies. Le Logo est le territoire compris entre Médine et Bafoulabé
57.0	AHMC-33-301	J.-E. Martial 		I. Mémoires originaux. La quinacrine dans la tierce maligne.	1935	33	301	
